{
  "asset_status": "SIMULATED",
  "disclaimer_ja": "これは実際に Microsoft Foundry 上へデプロイされた Hosted Agent ではありません。labs/08-hosted-multi-agent.md に記載された scripts/deploy_hosted_agent.py --output json の出力形状を示すために、講師が手作業で作成した架空の値です。project_endpoint・ai_services_account_name・foundry_project_name は実在しない架空の識別子で、実際の Azure サブスクリプション・テナント・リソース ID は一切含まれません。",
  "agent_name": "contoso-travel-hosted-planner",
  "version": "1",
  "status": "active",
  "succeeded": true,
  "project_endpoint": "https://simulated-account.services.ai.azure.invalid/api/projects/simulated-project",
  "portal_url": "https://ai.azure.com",
  "ai_services_account_name": "simulated-account",
  "foundry_project_name": "simulated-project",
  "failure_hint": null
}
